{"lastUpdated":"2026-04-05T12:12:10.010Z","sources":["EU Weekly Oil Bulletin — CC BY 4.0","World Bank Global Fuel Prices Database — ODbL","Our World in Data / IEA — Electricity prices — CC BY 4.0","Our World in Data — CO2 (Global Carbon Budget) — CC BY 4.0","Natural Earth 110m admin_0 countries — CC0"],"coverage":{"fuel":130,"electricity":88,"ev":88,"co2":167},"countries":[{"id":"AF","iso3":"AFG","name":"Afghanistan","lat":33.902427,"lng":67.84322900000001,"fuel":null,"electricity":null,"ev":null,"co2":{"year":2024,"tonnes_per_capita":0.254,"total_million_tonnes":10.83,"source":"Our World in Data (Global Carbon Budget)"}},{"id":"AL","iso3":"ALB","name":"Albania","lat":41.1566225,"lng":20.162263000000003,"fuel":null,"electricity":{"household_usd_per_kwh":0.128,"year":2025,"source":"Hardcoded fallback (IEA / Eurostat / GlobalPetrolPrices cited figures)"},"ev":{"home_usd_per_100km":2.3,"public_fast_usd_per_100km":3.69,"assumptions":{"consumption_kwh_per_100km":18,"fast_charger_markup":1.6}},"co2":{"year":2024,"tonnes_per_capita":1.592,"total_million_tonnes":4.44,"source":"Our World in Data (Global Carbon Budget)"}},{"id":"DZ","iso3":"DZA","name":"Algeria","lat":28.0878725,"lng":1.657553,"fuel":{"gasoline":0.3244589011302245,"diesel":0.2172154270125092,"lpg":0.0053910757479836815,"source":"World Bank Global Fuel Prices Database"},"electricity":{"household_usd_per_kwh":0.043,"year":2025,"source":"Hardcoded fallback (IEA / Eurostat / GlobalPetrolPrices cited figures)"},"ev":{"home_usd_per_100km":0.77,"public_fast_usd_per_100km":1.24,"assumptions":{"consumption_kwh_per_100km":18,"fast_charger_markup":1.6}},"co2":{"year":2024,"tonnes_per_capita":4.234,"total_million_tonnes":198.2,"source":"Our World in Data (Global Carbon Budget)"}},{"id":"AO","iso3":"AGO","name":"Angola","lat":-11.1843295,"lng":17.860000499999998,"fuel":{"gasoline":0.3256908704017945,"diesel":0.3256908704017945,"lpg":0.10856362346726485,"source":"World Bank Global Fuel Prices Database"},"electricity":null,"ev":null,"co2":{"year":2024,"tonnes_per_capita":0.589,"total_million_tonnes":22.33,"source":"Our World in Data (Global Carbon Budget)"}},{"id":"AR","iso3":"ARG","name":"Argentina","lat":-38.541155,"lng":-63.5218925,"fuel":{"gasoline":1.1594610576787916,"diesel":1.3750948536935288,"lpg":0.2714783693953385,"source":"World Bank Global Fuel Prices Database"},"electricity":{"household_usd_per_kwh":0.085,"year":2025,"source":"Hardcoded fallback (IEA / Eurostat / GlobalPetrolPrices cited figures)"},"ev":{"home_usd_per_100km":1.53,"public_fast_usd_per_100km":2.45,"assumptions":{"consumption_kwh_per_100km":18,"fast_charger_markup":1.6}},"co2":{"year":2024,"tonnes_per_capita":3.743,"total_million_tonnes":171.06,"source":"Our World in Data (Global Carbon Budget)"}},{"id":"AM","iso3":"ARM","name":"Armenia","lat":39.994665,"lng":45.044233,"fuel":null,"electricity":null,"ev":null,"co2":{"year":2024,"tonnes_per_capita":2.499,"total_million_tonnes":7.43,"source":"Our World in Data (Global Carbon Budget)"}},{"id":"AU","iso3":"AUS","name":"Australia","lat":-27.1513915,"lng":133.454211,"fuel":{"gasoline":1.0347461401712947,"diesel":1.063671138852088,"lpg":null,"source":"World Bank Global Fuel Prices Database"},"electricity":{"household_usd_per_kwh":0.327,"year":2025,"source":"Hardcoded fallback (IEA / Eurostat / GlobalPetrolPrices cited figures)"},"ev":{"home_usd_per_100km":5.89,"public_fast_usd_per_100km":9.42,"assumptions":{"consumption_kwh_per_100km":18,"fast_charger_markup":1.6}},"co2":{"year":2024,"tonnes_per_capita":14.477,"total_million_tonnes":386.73,"source":"Our World in Data (Global Carbon Budget)"}},{"id":"AT","iso3":"AUT","name":"Austria","lat":47.7354455,"lng":13.2298185,"fuel":{"gasoline":2.166,"diesel":2.541,"lpg":null,"source":"EU Weekly Oil Bulletin"},"electricity":{"household_usd_per_kwh":0.314,"year":2025,"source":"Hardcoded fallback (IEA / Eurostat / GlobalPetrolPrices cited figures)"},"ev":{"home_usd_per_100km":5.65,"public_fast_usd_per_100km":9.04,"assumptions":{"consumption_kwh_per_100km":18,"fast_charger_markup":1.6}},"co2":{"year":2024,"tonnes_per_capita":6.18,"total_million_tonnes":56.37,"source":"Our World in Data (Global Carbon Budget)"}},{"id":"AZ","iso3":"AZE","name":"Azerbaijan","lat":40.065526500000004,"lng":47.5934055,"fuel":{"gasoline":0.647001735141017,"diesel":0.5881833955827427,"lpg":null,"source":"World Bank Global Fuel Prices Database"},"electricity":null,"ev":null,"co2":{"year":2024,"tonnes_per_capita":3.853,"total_million_tonnes":39.83,"source":"Our World in Data (Global Carbon Budget)"}},{"id":"BS","iso3":"BHS","name":"Bahamas","lat":25.375,"lng":-77.99000000000001,"fuel":null,"electricity":null,"ev":null,"co2":{"year":2024,"tonnes_per_capita":7.65,"total_million_tonnes":3.07,"source":"Our World in Data (Global Carbon Budget)"}},{"id":"BD","iso3":"BGD","name":"Bangladesh","lat":23.558704499999997,"lng":90.37857149999999,"fuel":{"gasoline":1.003779600442239,"diesel":0.863908672511763,"lpg":0.9941806151921082,"source":"World Bank Global Fuel Prices Database"},"electricity":{"household_usd_per_kwh":0.059,"year":2025,"source":"Hardcoded fallback (IEA / Eurostat / GlobalPetrolPrices cited figures)"},"ev":{"home_usd_per_100km":1.06,"public_fast_usd_per_100km":1.7,"assumptions":{"consumption_kwh_per_100km":18,"fast_charger_markup":1.6}},"co2":{"year":2024,"tonnes_per_capita":0.624,"total_million_tonnes":108.32,"source":"Our World in Data (Global Carbon Budget)"}},{"id":"BY","iso3":"BLR","name":"Belarus","lat":53.7443165,"lng":27.9465685,"fuel":null,"electricity":null,"ev":null,"co2":{"year":2024,"tonnes_per_capita":6.163,"total_million_tonnes":55.82,"source":"Our World in Data (Global Carbon Budget)"}},{"id":"BE","iso3":"BEL","name":"Belgium","lat":50.50225399999999,"lng":4.335115500000001,"fuel":{"gasoline":2.131,"diesel":2.565,"lpg":1.215,"source":"EU Weekly Oil Bulletin"},"electricity":{"household_usd_per_kwh":0.409,"year":2025,"source":"Hardcoded fallback (IEA / Eurostat / GlobalPetrolPrices cited figures)"},"ev":{"home_usd_per_100km":7.36,"public_fast_usd_per_100km":11.78,"assumptions":{"consumption_kwh_per_100km":18,"fast_charger_markup":1.6}},"co2":{"year":2024,"tonnes_per_capita":7.28,"total_million_tonnes":85.46,"source":"Our World in Data (Global Carbon Budget)"}},{"id":"BZ","iso3":"BLZ","name":"Belize","lat":17.19346,"lng":-88.6679675,"fuel":{"gasoline":1.603525113527993,"diesel":1.5718244523050342,"lpg":5.682657492000001,"source":"World Bank Global Fuel Prices Database"},"electricity":null,"ev":null,"co2":{"year":2024,"tonnes_per_capita":1.909,"total_million_tonnes":0.8,"source":"Our World in Data (Global Carbon Budget)"}},{"id":"BJ","iso3":"BEN","name":"Benin","lat":9.188897,"lng":2.2847239999999998,"fuel":{"gasoline":1.1032271378002128,"diesel":1.1637379262190155,"lpg":1.52308840103497,"source":"World Bank Global Fuel Prices Database"},"electricity":null,"ev":null,"co2":{"year":2024,"tonnes_per_capita":0.419,"total_million_tonnes":6.07,"source":"Our World in Data (Global Carbon Budget)"}},{"id":"BT","iso3":"BTN","name":"Bhutan","lat":27.507921,"lng":90.45898,"fuel":null,"electricity":null,"ev":null,"co2":{"year":2024,"tonnes_per_capita":2.094,"total_million_tonnes":1.66,"source":"Our World in Data (Global Carbon Budget)"}},{"id":"BO","iso3":"BOL","name":"Bolivia","lat":-16.3174535,"lng":-63.5443975,"fuel":{"gasoline":1.2558460865130376,"diesel":1.2847826322852276,"lpg":0.32553613993713537,"source":"World Bank Global Fuel Prices Database"},"electricity":{"household_usd_per_kwh":0.086,"year":2025,"source":"Hardcoded fallback (IEA / Eurostat / GlobalPetrolPrices cited figures)"},"ev":{"home_usd_per_100km":1.55,"public_fast_usd_per_100km":2.48,"assumptions":{"consumption_kwh_per_100km":18,"fast_charger_markup":1.6}},"co2":{"year":2024,"tonnes_per_capita":2.313,"total_million_tonnes":28.71,"source":"Our World in Data (Global Carbon Budget)"}},{"id":"BA","iso3":"BIH","name":"Bosnia and Herz.","lat":43.941888500000005,"lng":17.674893,"fuel":{"gasoline":1.3592581348494466,"diesel":1.379957497309083,"lpg":null,"source":"World Bank Global Fuel Prices Database"},"electricity":{"household_usd_per_kwh":0.1,"year":2025,"source":"Hardcoded fallback (IEA / Eurostat / GlobalPetrolPrices cited figures)"},"ev":{"home_usd_per_100km":1.8,"public_fast_usd_per_100km":2.88,"assumptions":{"consumption_kwh_per_100km":18,"fast_charger_markup":1.6}},"co2":{"year":2024,"tonnes_per_capita":6.139,"total_million_tonnes":19.43,"source":"Our World in Data (Global Carbon Budget)"}},{"id":"BW","iso3":"BWA","name":"Botswana","lat":-22.2451795,"lng":24.663823,"fuel":{"gasoline":1.0365416358854556,"diesel":1.0832590053901523,"lpg":null,"source":"World Bank Global Fuel Prices Database"},"electricity":null,"ev":null,"co2":{"year":2024,"tonnes_per_capita":2.96,"total_million_tonnes":7.46,"source":"Our World in Data (Global Carbon Budget)"}},{"id":"BR","iso3":"BRA","name":"Brazil","lat":-14.261945999999998,"lng":-54.358614,"fuel":{"gasoline":1.0751569382304997,"diesel":1.0977005514514617,"lpg":1.2809841287627157,"source":"World Bank Global Fuel Prices Database"},"electricity":{"household_usd_per_kwh":0.165,"year":2025,"source":"Hardcoded fallback (IEA / Eurostat / GlobalPetrolPrices cited figures)"},"ev":{"home_usd_per_100km":2.97,"public_fast_usd_per_100km":4.75,"assumptions":{"consumption_kwh_per_100km":18,"fast_charger_markup":1.6}},"co2":{"year":2024,"tonnes_per_capita":2.278,"total_million_tonnes":483.01,"source":"Our World in Data (Global Carbon Budget)"}},{"id":"BN","iso3":"BRN","name":"Brunei","lat":4.7276834999999995,"lng":114.82736349999999,"fuel":null,"electricity":null,"ev":null,"co2":{"year":2024,"tonnes_per_capita":26.046,"total_million_tonnes":12.05,"source":"Our World in Data (Global Carbon Budget)"}},{"id":"BG","iso3":"BGR","name":"Bulgaria","lat":42.7347045,"lng":25.469303500000002,"fuel":{"gasoline":1.665,"diesel":1.867,"lpg":0.777,"source":"EU Weekly Oil Bulletin"},"electricity":{"household_usd_per_kwh":0.129,"year":2025,"source":"Hardcode